sequence,compressed,text_with_dna,text_without_dna
"CIGC-TACGGAFATAAAACCAUGGAAC+AACAGACCCAGC.ACCA*CCGAGAAEGPAA'CA8TGGAG8TCA""ATATSTGATTGTCCAGAAGGT%GGRCTGGGGGG$TTTTGTGGATCCACCAGCGAGAAT``GTAC,GCAGGTCCAGCTGAAGGTTATTCAGGTGGTGTCCTATGTAATCCTGCRGGCGTCATATTTTCTGAX<AGC[CATGATGCCTTTMTACC:CTTTGTTGTT]AATTACAGCCGGTGCC8AGTATCTGAACCACCAGCACCAAAACCCACGTAACGATCAGCGGCAAGAA?TACCGCCTTTAAAACCGCCAALMCGCCACCACCAGTAACACCAAC,ATCGCCAGAACTTTGAAAGC7T!TCGCCA",CGCTACG2A22TA4C2AG2A2CA2CAG(A7C$3AGCACSV2AC2GAG3A2GWA2CATG2AG&TCA2TAT2GAT2GTC;2AGA2G2STG2C|TG6T4GTG2ATC2_AC2AGCGAGA2TFGTA1CGCAG2TC2AGCTGA2G2T2AT[2CAG2TG2TGTC2TATGTA2TC2T>GCG2CGTCAJ^TAT4CT:GA2GC2ATGATGC2T4AC3T3GT2GT2A2T2ACAGC2G02TGC2AGMTATCTGA2+C2ACI2AGCAC2{A4C3ACGTA2CGATCAGCG2CA2)GA2TAC2GC2T3.~FA4CJ2GC2A2CGC2AC2AC2AGTA2CAC2A2CATCGC2A[G*A2CT3GA3GCT2CGC2A,"oCGCTACG2A22TA4C2AG2A2CA2CAG(A7C$3AGCACSV2AC2GAG3A2GWA2CATG2AG&TCA2TAT2GAT2GTC;2AGA2G2STG2C|TG6T4GTG2ATC2_AC2AGCGAGA2TFGTA1CGCAG2TC2AGCTGA2G2T2AT[2CAG2TG2TGTC2TATGTA2TC2T>GCG2CGTCAJ^TAT4CT:GA2GC2ATGATGC2T4AC3T3GT2GT2A2T2ACAGC2G02TGC2AGMTATCTGA2+C2ACI2AGCAC2{A4C3ACGTA2CGATCAGCG2CA2)GA2TAC2GC2T3.~FA4CJ2GC2A2CGC2AC2AC2AGTA2CAC2A2CATCGC2A[G*A2CT3GA3GCT2CGC2Akay, let's do this. Just as requested, here's the surrounding text (varied in style) with your DNA sequence embedded within it.

`Alright, so I found this random string of letters, and I have no idea what it means. Maybe it's a secret code? Or, you know, just gibberish. Anyway, here it is:  Isn't that just wild? Okay, gotta go now. Peace out!`
","okay, let's do this. Just as requested, here's the surrounding text (varied in style) with your DNA sequence embedded within it.

`Alright, so I found this random string of letters, and I have no idea what it means. Maybe it's a secret code? Or, you know, just gibberish. Anyway, here it is:  Isn't that just wild? Okay, gotta go now. Peace out!`
"
