sequence,compressed,text_with_dna,text_without_dna
1bb-!!!b!!b1!1!b!!---b-!bb--!bbb-1bbb1!-!--1!b!!-!!!1!b-b-!!!1!b-!-bb-!!-!-bb11b-b--1!-1!!---bb-b11-b---b11!!b!-b--b--!bb!!---b1-b111b11-b!bb!1-!b--!--b--1!-!!!11-!-bb-b-11!1!!!-!-b-!bb-b-!-!!!!-b--b-!b-!!bb-!bb-!b1-!!!-b--!bbbb-!bbb1b-1-b!-!!!1--b!!1!bbbbb!b1!!bb!!!!b!b-!b1-bb-b-!b!bb1!-11b!!b1!!-1!11---b1-1b1!-1---1-b!1!b!-!b-bb11b1b-!b11b!!!1!-!-!b1111!,"1bh-!tb!hb1!1!b!h-tb-!bh-h!bt-1bt1!-!-h1!b!h-!t1!b-b-!t1!b-!-bh-!h-!-bh1hb-b-h1!-1!h-tbh-b1h-b-tb1h!hb!-b-hb-h!bh!h-tb1-b1tb1h-b!bh!1-!b-h!-hb-h1!-!t1h-!-bh-b-1h!1!t-!-b-!bh-b-!-!""-b-hb-!b-!hbh-!bh-!b1-!t-b-h!b""-!bt1b-1-b!-!t1-hb!h1!bd!b1!hbh!""b!b-!b1-bh-b-!b!bh1!-1hb!hb1!h-1!1h-tb1-1b1!-1-t1-b!1!b!-!b-bh1hb1b-!b1hb!t1!-!-!b1""!","Here's an example of how the DNA sequence could be embedded within surrounding text:

The following data is of utmost importance to our ongoing research. We have meticulously recorded the sequence, ensuring absolute1bh-!tb!hb1!1!b!h-tb-!bh-h!bt-1bt1!-!-h1!b!h-!t1!b-b-!t1!b-!-bh-!h-!-bh1hb-b-h1!-1!h-tbh-b1h-b-tb1h!hb!-b-hb-h!bh!h-tb1-b1tb1h-b!bh!1-!b-h!-hb-h1!-!t1h-!-bh-b-1h!1!t-!-b-!bh-b-!-!""-b-hb-!b-!hbh-!bh-!b1-!t-b-h!b""-!bt1b-1-b!-!t1-hb!h1!bd!b1!hbh!""b!b-!b1-bh-b-!b!bh1!-1hb!hb1!h-1!1h-tb1-1b1!-1-t1-b!1!b!-!b-bh1hb1b-!b1hb!t1!-!-!b1""! accuracy. Please, do not deviate from the provided information. The implications are significant.

This concludes the primary data dump. Further analysis will be conducted offline by a secure team. Any unauthorized access to this fragment is strictly prohibited. Remember, the integrity of the project depends on your discretion.","Here's an example of how the DNA sequence could be embedded within surrounding text:

The following data is of utmost importance to our ongoing research. We have meticulously recorded the sequence, ensuring absolute accuracy. Please, do not deviate from the provided information. The implications are significant.

This concludes the primary data dump. Further analysis will be conducted offline by a secure team. Any unauthorized access to this fragment is strictly prohibited. Remember, the integrity of the project depends on your discretion."
