sequence,compressed,text_with_dna,text_without_dna
;;MM;+MM+;;;!+MM;+!MM;+;!++!M+MM+;+++M+MM;+!M!!!!+;;!+;M!!M;;+;;M;+!M!;!;!+;!+;++;;;M;MM;+M+;!MM;+MMM;!!++;+!!;+;+!+;!+M;+;MMM;;M!++!;M;;M+!+;!+M!+MM++;++;;!+;M;M;!MMM+M!++;+MM!M!M!!+M++;!+M!;!+M!++!+!+++;M+;;+++M!;MMM+;+;;M+M;!!;;!+MMM+M!M!;++!++,;dMd;+Md+;>!+Md;+!Md;+;!+d!M+Md+;+>M+Md;+!M!}+;d!+;M!dM;d+;dM;+!M!;!;!+;!+;+d;>M;Md;+M+;!Md;+M>;!d+d;+!d;+;+!+;!+M;+;M>;dM!+d!;M;dM+!+;!+M!+Md+d;+d;d!+;M;M;!M>+M!+d;+Md!M!M!d+M+d;!+M!;!+M!+d!+!+>;M+;d+>M!;M>+;+;dM+M;!d;d!+M>+M!M!;+d!+d,"Okay, here's the DNA sequenc;dMd;+Md+;>!+Md;+!Md;+;!+d!M+Md+;+>M+Md;+!M!}+;d!+;M!dM;d+;dM;+!M!;!;!+;!+;+d;>M;Md;+M+;!Md;+M>;!d+d;+!d;+;+!+;!+M;+;M>;dM!+d!;M;dM+!+;!+M!+Md+d;+d;d!+;M;M;!M>+M!+d;+Md!M!M!d+M+d;!+M!;!+M!+d!+!+>;M+;d+>M!;M>+;+;dM+M;!d;d!+M>+M!M!;+d!+de embedded in surrounding text with varying styles:

wow, this is like, a totally awesome sequence or something. i dunno, biology is hard. but here it is:  Isn't that just fascinating? Makes you think about the grand scheme of things, doesn't it? Or maybe just dinner. I'm hungry.
","Okay, here's the DNA sequence embedded in surrounding text with varying styles:

wow, this is like, a totally awesome sequence or something. i dunno, biology is hard. but here it is:  Isn't that just fascinating? Makes you think about the grand scheme of things, doesn't it? Or maybe just dinner. I'm hungry.
"
