sequence,compressed,text_with_dna,text_without_dna
dsssddsdK33s3ds333dKd3ddKKdd3s33dKKsd3KdssKK33sKssdK33sdsdKss333ssKs3sK3KKKKssdKs33ss33sKdss3sKKKdsds3K33KKKK3sddKddd333KdKddd3ss3ss3sKdsK3ddds3dddsdddssK,"ds""dbsdK3bs3ds3""dKd3dbKbdb3s3bdKbsd3KdsbKb3bsKsbdK3bsdsdKsb3""sbKs3sK3K2sbdKs3bsb3bsKdsb3sK""dsds3K3bK23sdbKd""3""KdKd""3sb3sb3sKdsK3d""s3d""sd""sbK","Okay, here is the DNA sequence embedded within the required text.

The cds""dbsdK3bs3ds3""dKd3dbKbdb3s3bdKbsd3KdsbKb3bsKsbdK3bsdsdKsb3""sbKs3sK3K2sbdKs3bsb3bsKdsb3sK""dsds3K3bK23sdbKd""3""KdKd""3sb3sb3sKdsK3d""s3d""sd""sbKat sat on the ma...hang on...where was I? Oh yes, the importance of molecular biology and its potential for unlocking secrets of life itself... but before I get carried away, lets examine this code here:  pretty neat, huh? Ok gotta run, the laundry is calling, lol.
","Okay, here is the DNA sequence embedded within the required text.

The cat sat on the ma...hang on...where was I? Oh yes, the importance of molecular biology and its potential for unlocking secrets of life itself... but before I get carried away, lets examine this code here:  pretty neat, huh? Ok gotta run, the laundry is calling, lol.
"
