sequence,compressed,text_with_dna,text_without_dna
CAACCGCGTTACCTGCACTGGAGGCCAGTACCTGATTCATGTCGGTGAGCAGCGCGGTGGTGCGCACGCCAGCGCCGTTAGCCACGCCAACAATCGCTTCGGCAAGGGCTTCAGAGAGTTCGTAGGTCGGCATAAACGCGCCGCTACCCACTTTCACGTCCATCACCAGCGCGTCCAGACCTTCCGCCAGTTT,CA2C2GCGT2AC2TGCACTG2AG2C2AGTAC2TGAT2CATGTCG2TGAGCAGCGCG2TG2TGCGCACGC2AGCGC2GT2AGC2ACGC2A2CA2TCGCT2CG2CA2G3CT2CAGAGAGT2CGTAG2TCG2CATA3CGCGC2GCTAC3ACT3CACGTC2ATCAC2AGCGCGTC2AGAC2T2C2GC2AGT3,"Okay, here's the embedded DNA sequence as requested:

""The quick brown fox jumps over the lazy dog. You know, that old chestnut. Anyways, checCA2C2GCGT2AC2TGCACTG2AG2C2AGTAC2TGAT2CATGTCG2TGAGCAGCGCG2TG2TGCGCACGC2AGCGC2GT2AGC2ACGC2A2CA2TCGCT2CG2CA2G3CT2CAGAGAGT2CGTAG2TCG2CATA3CGCGC2GCTAC3ACT3CACGTC2ATCAC2AGCGCGTC2AGAC2T2C2GC2AGT3k *this* out:   fasdf;laksdjfl;aksjdf;laksjdfl;kasjdf. Did you SEE that? Amazing!""
","Okay, here's the embedded DNA sequence as requested:

""The quick brown fox jumps over the lazy dog. You know, that old chestnut. Anyways, check *this* out:   fasdf;laksdjfl;aksjdf;laksjdfl;kasjdf. Did you SEE that? Amazing!""
"
