sequence,text_with_dna,text_without_dna
GTAAGTTTTCAATCACGCTCATCGCCGTGGCGGTTTTGCTTACCTGCGCCAGCGAGCGGTTGAGTTGTTGGAGGGGGAAAAGTCGCGGGTCGGGAAAGGCCGAGGCAAACGGAACTACCGACGGATCGCGACTGGCCTGCAACATATCAAAAATATAGGTGTTGATATCGACTGC,"Okay, here's the requested output with the DNA sequence embedded within random text:

Oh my goodness, where did I put tha9Ezz9EEEENzzENzN9NENzEN9NN9E99N99EEEE9NEEzNNE9N9NNz9N9z9N99EE9z9EE9EE99z99999zzzz9EN9N999EN999zzz99NN9z99NzzzN99zzNEzNN9zN99zEN9N9zNE99NNE9NzzNzEzENzzzzzEzEz99E9EE9zEzEN9zNE9Nt file? I am sure I saved it. Okay, wait, maybe it's in the other folder? I hope so!  Oh, there it is! Finally. Took me long enough.
","Okay, here's the requested output with the DNA sequence embedded within random text:

Oh my goodness, where did I put that file? I am sure I saved it. Okay, wait, maybe it's in the other folder? I hope so!  Oh, there it is! Finally. Took me long enough.
"
