sequence,text_with_dna,text_without_dna
TTATACAATTCTGATGATTCTGCCGTCTTTGCCAGCAGGCGCGGACGGTGTTTTCACGCATTCAAATCTGACTGGTACCAGCATCCCCCATGCACTGAAGAACAGGCCGAATGGCTCATTCAGTGTTACCGCAGGCGCGGATGCGAGGTTAAAAAAGCC,"Okay, here's the DNA sequence embedded in surrounding text, following your specifications:

This is just some random filler text. I need to add a bunch of characters before the actual sequence so that the output meets tTZTSAOT%A9c9AOA1T3TXceTsGhAPT2GBAVTmTZceTOG#c$c8GWTFc*TDTqT^GIcSc1A7Gzc!ABGVG
cjGycNGYGmA8cNGOG3TzGRTET#TpTVcMAgc^GQcqAbTsTocmAyA#ArTFcnTIG9AfceT!GoGOT*Atc4cyAVGwcIA*TvcUc9c9c4cSAbToG	c7AHc*TmGaACA8GIA%AzcDAgGXGXc8c7GLA1AaTJGhG8coT^cqA6TxTecyAWG8TbGET3TpAgc0c5G	cpApG0GfclGEcXG$G6AmT8GWcKGQAHG^GQThTMA!AEA^A3A#A1Gvc5c^he length requirements. Blah blah blah, here it comes!  And now we need some random characters added to the end. This is fun. Testing testing 1 2 3. That should do it.
","Okay, here's the DNA sequence embedded in surrounding text, following your specifications:

This is just some random filler text. I need to add a bunch of characters before the actual sequence so that the output meets the length requirements. Blah blah blah, here it comes!  And now we need some random characters added to the end. This is fun. Testing testing 1 2 3. That should do it.
"
