sequence,text_with_dna,text_without_dna
GAAGTCCGTGAAATCGAAGTTCGTGGCCGTAACCTGGCAGAAGGTGTTCCACGCGGTTTTACCCTGAACTCCAATGAAATCCTCGAAGCACTGCAGGAACCGCTGACCGGTATTGTGAGCGCGGTAATGGTTGCACTGGAACAGTGCCCGCCGGAACTGGCTTCCGACATCTCCGAG,"Okay, here's the output string, embeddigRa4azgbT*CqCHgxTYgMa7ata@T@CSgtaNaNgfTFTACrgITlgtgzCmC	gOTUaBauCPCoT	gJg1CbaigYaka6gYgKT4gYT^T1CHCxa9CPg@CLgWgPTkTfToTbaxCtCICBT*gfaAaOCbTPCKCqa^asT*gPaIaqarTyCDCUTwCxg5akaOgQCVaGCJTKgrClavg6g%aGa&CKC0gzC!TRgRaGCpCkgIgXT!a2TFT#g	T4gVa7g*CjgZC$gqgzTqa5a%TYgFgnToTWg
CMadCyTSgpg7aDazCda^gxT5g6CsCLCfgRC1COgNg&aUa#ChTLgmg8C!TMT6CDCNgBa5CpafTYCQTtC3C#gLa
g5ng the provided DNA sequence as requested, with varied surrounding text:

Wow, it's quite something when you consider the sheer immensity of the cosmos, isn't it? Also, my grocery list: milk, eggs, butter,  and uh, paper towels... oh and dont forget PICKLES. Did you get the pickles? I need pickles.
","Okay, here's the output string, embedding the provided DNA sequence as requested, with varied surrounding text:

Wow, it's quite something when you consider the sheer immensity of the cosmos, isn't it? Also, my grocery list: milk, eggs, butter,  and uh, paper towels... oh and dont forget PICKLES. Did you get the pickles? I need pickles.
"
