sequence,compressed,text_with_dna,text_without_dna
CCAACGAAGMSCTGAHCGTYABGRTGGTAGAAGCGGGAGAACGNATTTTGCCTGBAYTACCGCCNBGHATCTCTGCTGCGGCCCACANCKAGCTASCGAADCYTGWHGTTCGCGTGWSGACMCRAACCATGYTCACCAVTGCTMATGAAGGCGGCVTSCAKACTAAAGATGGCGAATAWATVGAWGCTDATCTGBTGGTGTGGGYAGCCGGGATCAAAGCGCHAGACTTCCTGDAAGATATCGGTGG,C2A2CGA2GCWTGAYCGTH2CGCYGRTHNA2GCY3BGA2CMTAT4GC2YGCATSAC2GC2ACGTATCTCTGCTGCG2C3ACADCGAGCTR2CGA3HTNG2CGT2CGCGTGCTGDCMCA3B2ATD2TCAC2AYTGCTMATGY2W2CG2C2TGCACACSV3GATG2BGA2TATAN2GAG2CTGATCTGAKG2TGTS3CAGC2G3ATCA3MCGW2AGAKT2Y2TGA3GATATCG2VG2,"Okay, here's the DNA sequencC2A2CGA2GCWTGAYCGTH2CGCYGRTHNA2GCY3BGA2CMTAT4GC2YGCATSAC2GC2ACGTATCTCTGCTGCG2C3ACADCGAGCTR2CGA3HTNG2CGT2CGCGTGCTGDCMCA3B2ATD2TCAC2AYTGCTMATGY2W2CG2C2TGCACACSV3GATG2BGA2TATAN2GAG2CTGATCTGAKG2TGTS3CAGC2G3ATCA3MCGW2AGAKT2Y2TGA3GATATCG2VG2e embedded in surrounding text with varying styles:

wow, this is like, a totally awesome sequence or something. i dunno, biology is hard. but here it is:  Isn't that just fascinating? Makes you think about the grand scheme of things, doesn't it? Or maybe just dinner. I'm hungry.
","Okay, here's the DNA sequence embedded in surrounding text with varying styles:

wow, this is like, a totally awesome sequence or something. i dunno, biology is hard. but here it is:  Isn't that just fascinating? Makes you think about the grand scheme of things, doesn't it? Or maybe just dinner. I'm hungry.
"
