sequence,compressed,text_with_dna,text_without_dna
TCATCVCAGAKTBMCTGAAAGVTTTACTAVGAGCGHSTTTACAGCAGCATAAACTGAATCCRGCNAAGHTCGTYGCGBTATTTGGCGGTGGYATTTAAHCGATCATSAGNTTSAGTGACWAAGTGGTCATADCGCAATGATAAAAGTGACRCAABTCSRATAGBAATYTTTCGTGCGCANTKCGTRCTGGCGATAATAATTAASCA,TCATSACAGAGTGTCTGB3Y2T3ACRACGAGCH2AS3ACAGCAWCATA3CTDA2TC2ASWABGK2SGB2GKGT2AT3G2CG2TG2TAT3A3CGATCATSAGAT2CAGTGBCDA2GVG2TWATATHGCA2TGATA4GTGACACA2T2ST2ATAGMA2N5DGTYCGCAT3KGT2CTG2CGABA2TA2T2A2TCA,"Okay, I understand. Here's the output with the DNA sequence embedded as requested:

The quiTCATSACAGAGTGTCTGB3Y2T3ACRACGAGCH2AS3ACAGCAWCATA3CTDA2TC2ASWABGK2SGB2GKGT2AT3G2CG2TG2TAT3A3CGATCATSAGAT2CAGTGBCDA2GVG2TWATATHGCA2TGATA4GTGACACA2T2ST2ATAGMA2N5DGTYCGCAT3KGT2CTG2CGABA2TA2T2A2TCAck brown fox jumped over the lazy fox.  zzzz...and that's all she wrote.
","Okay, I understand. Here's the output with the DNA sequence embedded as requested:

The quick brown fox jumped over the lazy fox.  zzzz...and that's all she wrote.
"
