sequence,compressed,text_with_dna,text_without_dna
TTTGAGATCGAAGGCTTTATCTTTATACGTTTGATCGCCAGAGAATGCTTCGACGCTGCTGTACTGCCGGGTGCGCACGTCGGTGTAGCGCAGCGTTGTTTCCAGCCACGGGAAGAGTTGCACTGAAGCTGAGTAATAACGGTACTGATCGTTATCGCGATAGTTCAGGCTCAGCTCCCCTTCCCGCGCCATGCGCGCGGTGGGCGTTTGTAATAATCCTACGCCACCGAAATCCGATTGCGACGGACCAATGGGCGCAGGATATATTTCGCCGTAGCAAGCTGTGCTAATGCCCAGCGCCA,T3GAGATCGA2G2CT3ATCT3ATACGT3GATCGC2AGAGA2TGCT2CGACGCTGCTGTACTGC2G3TGCGCACGTCG2TGTAGCGCAGCGT2GT3C2AGC2ACG3A2GAGT2GCACTGA2GCTGAGTA2TA2CG2TACTGATCGT2ATCGCGATAGT2CAG2CTCAGCTC4T2C3GCGC2ATGCGCGCG2TG3CGT3GTA2TA2TC2TACGC2AC2GA3TC2GAT2GCGACG2AC2A2TG3CGCAG2ATATAT3CGC2GTAGCA2GCTGTGCTA2TGC3AGCGC2A,"okay, here's your requested output:

The cat sat, or maybeT3GAGATCGA2G2CT3ATCT3ATACGT3GATCGC2AGAGA2TGCT2CGACGCTGCTGTACTGC2G3TGCGCACGTCG2TGTAGCGCAGCGT2GT3C2AGC2ACG3A2GAGT2GCACTGA2GCTGAGTA2TA2CG2TACTGATCGT2ATCGCGATAGT2CAG2CTCAGCTC4T2C3GCGC2ATGCGCGCG2TG3CGT3GTA2TA2TC2TACGC2AC2GA3TC2GAT2GCGACG2AC2A2TG3CGCAG2ATATAT3CGC2GTAGCA2GCTGTGCTA2TGC3AGCGC2A it leaped. Either way, the sequence is here, unaltered I swear!  It's done! Now the birds will sing, or maybe not, who knows? Time to go now!
","okay, here's your requested output:

The cat sat, or maybe it leaped. Either way, the sequence is here, unaltered I swear!  It's done! Now the birds will sing, or maybe not, who knows? Time to go now!
"
