sequence,compressed,text_with_dna,text_without_dna
-99-TTT9T99TT--T9S-9S-S9T-9TTT9S9-TT-9STST-TTSST---9---9ST-S9ST-ST999-9-9-99ST999-TTT9T99T99T99TT9SS-T9S---SS-9---9S-T-9--9TS--SSS9-99T999TSSSST-9T-9SS9TS-TT99-9S-SSTST999-S--99-ST99-99TT9STSTT9-T-T9-9TS---ST9SSSTT--9TS-ST-T99--9-S99-T9TT9S9-SS-S99TT9-,-9a-T~9T9aTa-aT9S-9S-S9T-9T~9S9-Ta-9STST-TaSaT-~9-~9ST-S9ST-ST9~-9-9-9aST9~-T~9T9aT9aT9aTa9Sa-T9S-~Sa-9-~9S-T-9-a9TS-aS~9-9aT9~TSNT-9T-9Sa9TS-Ta9a-9S-SaTST9~-S-a9a-ST9a-9aTa9STSTa9-T-T9-9TS-~ST9S~Ta-a9TS-ST-T9a-a9-S9a-T9Ta9S9-Sa-S9aTa9-,"Okay, here's the output string with the DNA sequence embedded in random text:

The quick bro-9a-T~9T9aTa-aT9S-9S-S9T-9T~9S9-Ta-9STST-TaSaT-~9-~9ST-S9ST-ST9~-9-9-9aST9~-T~9T9aT9aT9aTa9Sa-T9S-~Sa-9-~9S-T-9-a9TS-aS~9-9aT9~TSNT-9T-9Sa9TS-Ta9a-9S-SaTST9~-S-a9a-ST9a-9aTa9STSTa9-T-T9-9TS-~ST9S~Ta-a9TS-ST-T9a-a9-S9a-T9Ta9S9-Sa-S9aTa9-wn fox jumps over the lazy dog. Or does it? Maybe the dog is actually quite spry, and the fox is just...misguided. Anyway, here's some...stuff:  Furthermore, I contend that purple is the best color. No, wait, maybe cerulean.  The end.
","Okay, here's the output string with the DNA sequence embedded in random text:

The quick brown fox jumps over the lazy dog. Or does it? Maybe the dog is actually quite spry, and the fox is just...misguided. Anyway, here's some...stuff:  Furthermore, I contend that purple is the best color. No, wait, maybe cerulean.  The end.
"
