sequence,compressed,text_with_dna,text_without_dna
5*//'5**'**/5*/*'5/'5**'5/555/'//'*'*//55/''/*/*'*/*5/''*5*55*/*'/5*//*/5/55*'////'*'/'5'5*'*5//5*''5*''5*'*555''5'*'5555**5*///'*'/5'5**'5*/5*5*'5**5*/*'//*'/*55''/'*//*'///'//5/5*/'5*/,5*/~'5*~'*~/5*/*'5/'5*~'5/58/'/~'*'*/~5~/'~/*/*'*/*5/'~*5*5~*/*'/5*/~*/5/5~*'/g'*'/'5'5*'*5/~5*'~5*'~5*'*58'~5'*'5g*~5*/8'*'/5'5*~'5*/5*5*'5*~5*/*'/~*'/*5~'~/'*/~*'/8'/~5/5*/'5*/,"Okay, I understand. Here's the output with the DNA sequence embedded in arbitrary text:

The other day, while wan5*/~'5*~'*~/5*/*'5/'5*~'5/58/'/~'*'*/~5~/'~/*/*'*/*5/'~*5*5~*/*'/5*/~*/5/5~*'/g'*'/'5'5*'*5/~5*'~5*'~5*'*58'~5'*'5g*~5*/8'*'/5'5*~'5*/5*5*'5*~5*/*'/~*'/*5~'~/'*/~*'/8'/~5/5*/'5*/dering through the digital archives, I stumbled upon this fascinating string... it looked familiar, but I couldn't quite place it... maybe some old code? Wait, here it is: . Anyways, that got me thinking about linguistics and cryptography, and how much they share in common! What do you think?
","Okay, I understand. Here's the output with the DNA sequence embedded in arbitrary text:

The other day, while wandering through the digital archives, I stumbled upon this fascinating string... it looked familiar, but I couldn't quite place it... maybe some old code? Wait, here it is: . Anyways, that got me thinking about linguistics and cryptography, and how much they share in common! What do you think?
"
