sequence,compressed,text_with_dna,text_without_dna
"TCGTCCG$GAAATGCGCC'TGAAACTGGCGAGCATTCTGGCGAAGTTGATGAATCTGCCAGCGCCGAATCCSTGAAGCG7CCGCGTGIAAGGXCGTAG*TGGTACCCCCGGTACCGGA`0TCAGGAAC{CTG^AGGCC=TGATAACTGATAAGGGC}AGGGCCACTGGCOTCTGCCCTTTSTGC1TA*TTCTR9CACCG:TAACGAATCAGCGGATACCATGATTATCJAAACGCAC5QTCC(TCAAGC2CGCGTCGCCTCTGGCTTCGTGGCTTTCTTAT/`CTGGAAAACCT,UGCACAGTAAAACTATC_7]GATCTCGGCCTTGAGCG_XCGTGAGCCTGGTCGCGGCGCGTCTTGGCGTCCT{GAAACCAGCGCC%ATTTGTGTTTACCGTT","TCGTC2G2A3TGCGC2TGA3CT2G2CGAGCAT2CTGV2CGA2GT2GATGA2TCTGC2AGCGC*?2G;A2TC2TGA2GCGC2GCG%TGA2,G2CGTAGTG2/TAC5G2TAC2G2ATCAG2A2C2TGAG@2C2TG(ATA2CTGATA2G3CAG3C2ACTG2CTCTGC3T4GC;TAT2CTCAC2GT1(.A2CGA2TCAGCG2A~TAC2ATGAT2ATCA3CGC<ACTC2TCA2GC2%G(CGTCGRC2T`CQTG2CT2C=GT]1G2CPT3CT2ATCTG2A4C2MTGCACAGTA4CTATCGA$TCTC#G2C2T2GAG-CGC""GTGAGC2TG2TCGCG2CGCGTCT2G2CGTC2TGA35C2AGCGC2AT3)4GTGT3AC2GT>2","Okay, here's the output with the DNA sequence embedded as requested:

The quick brown fTCGTC2G2A3TGCGC2TGA3CT2G2CGAGCAT2CTGV2CGA2GT2GATGA2TCTGC2AGCGC*?2G;A2TC2TGA2GCGC2GCG%TGA2,G2CGTAGTG2/TAC5G2TAC2G2ATCAG2A2C2TGAG@2C2TG(ATA2CTGATA2G3CAG3C2ACTG2CTCTGC3T4GC;TAT2CTCAC2GT1(.A2CGA2TCAGCG2A~TAC2ATGAT2ATCA3CGC<ACTC2TCA2GC2%G(CGTCGRC2T`CQTG2CT2C=GT]1G2CPT3CT2ATCTG2A4C2MTGCACAGTA4CTATCGA$TCTC#G2C2T2GAG-CGC""GTGAGC2TG2TCGCG2CGCGTCT2G2CGTC2TGA35C2AGCGC2AT3)4GTGT3AC2GT>2ox jumps over the lazy fox, or does it? That's a question for the ages, or at least for this silly example. Anyhow, here we go. This is a test.  Okay, now some more text. La di da. Testing, testing, 1, 2, 3. All done! I hope it works.
","Okay, here's the output with the DNA sequence embedded as requested:

The quick brown fox jumps over the lazy fox, or does it? That's a question for the ages, or at least for this silly example. Anyhow, here we go. This is a test.  Okay, now some more text. La di da. Testing, testing, 1, 2, 3. All done! I hope it works.
"
