sequence,compressed,text_with_dna,text_without_dna
"TTTG`AGATCGAAGGCQTT%TATCTT9TATACGMTTTG#ATCGCCAGA-GAATGCTTCGACGCTGCTGTACTGCCGGGTGCGCACGTCGGTGTAGCGCAGCRGTTGTTTC)CAGCLCACFMGGGAAGAGTTGCACTGZAAGCTGAGTAATAACGGTAC,TGATCGTTATCGCGATAGQTTCAGGCTCAGCTCCCCTTCCCGCGCCATGZCGC/GCGG<TGGGCGTTTGTAQATAATCCTACGSCCAC-CGAA^ATCUCG7ATTGCGACGGAQC$CAATGGGCGCAGGATJATATT=TCGCC'GTAGCAAGCTGTGCTAATGCCCAGOCGCCA","T3GAGA#TCGA2G2CT3ATCT3ATACGT3YGATC$GC2/AGAGA?,2TGCT2CWGA+CGCTGCTGTAC?TGC2G3TG>CGCA,CGFTCG2TG9TAGCGCAGCGT2GT3C2AGC2ACG3A2GAGT2GCACTGA2GCTGFAGTA2TA2CG2TACTGATCGT2ATCG:CGATA=GT2CA5G2CTCAGCTC4T2C3GCGC2ATGCGCGCG2TG3CGT3GTAU2TA2TC2TACGC2AC2GZ=A3TC2GA,T2GCGACGJJ2AC2A2TG3CGCAG2ATATAMT3C@G>C2G7TAGCA2GCTGTGCTA2TGC3AGCGC*2A","okay, here's your requested output:

The cat sat, or maybeT3GAGA#TCGA2G2CT3ATCT3ATACGT3YGATC$GC2/AGAGA?,2TGCT2CWGA+CGCTGCTGTAC?TGC2G3TG>CGCA,CGFTCG2TG9TAGCGCAGCGT2GT3C2AGC2ACG3A2GAGT2GCACTGA2GCTGFAGTA2TA2CG2TACTGATCGT2ATCG:CGATA=GT2CA5G2CTCAGCTC4T2C3GCGC2ATGCGCGCG2TG3CGT3GTAU2TA2TC2TACGC2AC2GZ=A3TC2GA,T2GCGACGJJ2AC2A2TG3CGCAG2ATATAMT3C@G>C2G7TAGCA2GCTGTGCTA2TGC3AGCGC*2A it leaped. Either way, the sequence is here, unaltered I swear!  It's done! Now the birds will sing, or maybe not, who knows? Time to go now!
","okay, here's your requested output:

The cat sat, or maybe it leaped. Either way, the sequence is here, unaltered I swear!  It's done! Now the birds will sing, or maybe not, who knows? Time to go now!
"
