sequence,text_with_dna,text_without_dna
GGCTGGGTTGGCAATGGTGTCTACGTTTCTGGTGTGCAGCGTGAGTATGATGCTTTTATTACCAACCAGTTACGTGCGGCGCAGACGCAAAGTAGCGGCCTGACTGCCCGCTATGAGCAGATGTCGAAAATCGACAATATGCTCTCCACCAGTACCTCTTCGCTGGCAACACAGATGCAGGATTTCTTCACCAGCCTGCAAACGCTGGTGAGTA,"Okay, here's the embedded DNA sequence as requested:

""The quick brown fox jumps over the lazy dog. You know, that old chestnut. Anyways, check *this* out:   fasdf;laksdjfl;aksjdf;laksjdfl;kasjdf.G
GgcATbGHGuGQTKT
GiGBc4a3a*T#GsGATNGBTscjTtaKcEGSTfTlTLc7T9GVG1T^GCTqGZcJaRGdc3G*TsGEa@GCT4aqTfG%agTyGYczTETjT#TZaPT3TOaOcJc7aLaZc8c1aOGYTKTbasc3GiTUGbc$GjG0cgGQcoa1G!aYc&GUcqa5a4aLGdTpaLG7c5G
GwcWc!T$G*a^c2T@G*c#cncRG5cNTWaxTeGWaFGBcmaPGOawT8GITsc8GJaFaxa@abT^chGEaWctalaIT$a7TfG#c%TRcDTgcEcla8cAcXa6G7THajc*c	TVc!T*TrcJGJcqTBG1Guc3aKa1cqaScKa8GHaxTmG#c7aFGSGHaIT7T7T@cDT	Tkc1aQc3c3agGWcVc%TIG%ceaJahaQcNGYcqTKG4GjTVGUasG	TjaJ Did you SEE that? Amazing!""
","Okay, here's the embedded DNA sequence as requested:

""The quick brown fox jumps over the lazy dog. You know, that old chestnut. Anyways, check *this* out:   fasdf;laksdjfl;aksjdf;laksjdfl;kasjdf. Did you SEE that? Amazing!""
"
